{"type":"semantic_snapshot","schema":"code-structure-viz.semantic/v1","domain":"sqlalchemy","document_kind":"snapshot","status":"complete","source":{"schema":"code-structure-viz.source-view/v1","kind":"working-tree","head_commit":"cb399581e2840718c18d63149972f5567a5c0d4c","fingerprint":"c6219ba82309407d647ae80d4314cecc30dadb2bb3719967b11dc67c4c69c7e2","file_count":1},"request":{"targets":[],"upstream_depth":1,"downstream_depth":1},"coverage":{"candidate_files":1,"parsed_files":1,"failed_files":[],"evidence_files":["src/models.py"],"selected_modules":["models"],"mapped_classes":0,"association_tables":0,"selected_entities":2,"unknown_declarations":0,"frontier":[],"redaction":{"rule_version":"code-structure-viz.sqlalchemy-redaction/v1","redacted_values":0}},"entities":[{"id":"sqlalchemy:table:acf4af6f78cd92591f9b04e80c29a4cc5225e513ed95612ab7ada58b385a5aa7","kind":"table","schema_name":null,"name":"\"","display_name":"<default>.\"","mapping_kind":"table","mapping_sources":[{"kind":"table","module":"models","symbol":"models.quoted","source":{"path":"src/models.py","range":{"start_line":3,"end_line":3}}}]},{"id":"sqlalchemy:table:bfe33f1f2d8ccdb17c00cf5eaab455c464c13298b737b0c0e7e65a78f284adac","kind":"table","schema_name":null,"name":"_U0022_","display_name":"<default>._U0022_","mapping_kind":"table","mapping_sources":[{"kind":"table","module":"models","symbol":"models.encoded","source":{"path":"src/models.py","range":{"start_line":4,"end_line":4}}}]}],"members":[],"relations":[],"diagnostics":[]}
