{"type":"semantic_snapshot","schema":"code-structure-viz.semantic/v1","domain":"python","document_kind":"snapshot","status":"complete","source":{"schema":"code-structure-viz.source-view/v1","kind":"working-tree","head_commit":"8cd717695564b662ac4861bbb5a2b77fe880d371","fingerprint":"3fd83dfd5aedae13c5ce95d785ad262f45e012e151559504a1c216bf617b96b8","file_count":4},"request":{"targets":[{"kind":"class","value":"app.a.A"}],"upstream_depth":0,"downstream_depth":1},"coverage":{"candidate_files":4,"parsed_files":4,"failed_files":[],"selected_modules":["app.a","app.b"],"selected_entities":2,"frontier":[{"direction":"downstream","kind":"class","reference":"python:class:app.c:C","reason":"depth_limit"},{"direction":"downstream","kind":"module","reference":"python:module:app.c","reason":"depth_limit"}]},"entities":[{"id":"python:class:app.a:A","kind":"class","module":"app.a","qualified_name":"A","name":"A","path":"src/app/a.py","range":{"start_line":4,"end_line":5},"decorators":[]},{"id":"python:class:app.b:B","kind":"class","module":"app.b","qualified_name":"B","name":"B","path":"src/app/b.py","range":{"start_line":4,"end_line":5},"decorators":[]}],"members":[{"id":"python:member:9e8c1a7a5f13e61f29f2959a3163ea89d73bd35e0a54833e05d14504a66e6aae","owner_id":"python:class:app.a:A","kind":"field","name":"dependency","scope":"class","property_role":null,"method_kind":null,"annotation":"app.b.B","signature":null,"decorators":[],"range":{"start_line":5,"end_line":5}},{"id":"python:member:77490bb9643350649415daa1b74bdda37708758cadd7cf1934f332963ccaae9f","owner_id":"python:class:app.b:B","kind":"field","name":"dependency","scope":"class","property_role":null,"method_kind":null,"annotation":"app.c.C","signature":null,"decorators":[],"range":{"start_line":5,"end_line":5}}],"relations":[{"id":"python:relation:b34ea954a9212418e0693e50ba5652c87eada8527cb720d84e30e488a14f16ce","kind":"composition","source_id":"python:class:app.a:A","target":{"resolution":"internal","kind":"class","id":"python:class:app.b:B","name":"app.b.B"},"via_member_id":"python:member:9e8c1a7a5f13e61f29f2959a3163ea89d73bd35e0a54833e05d14504a66e6aae","annotation":"app.b.B","range":{"start_line":5,"end_line":5}},{"id":"python:relation:b86e2483ff7fbd026714a87821d76d587577d534a79123e9f11586e2d204df11","kind":"import_dependency","source_id":"python:module:app.a","target":{"resolution":"internal","kind":"module","id":"python:module:app.b","name":"app.b"},"via_member_id":null,"annotation":null,"range":{"start_line":1,"end_line":1}}],"diagnostics":[]}
