{"type":"semantic_snapshot","schema":"code-structure-viz.semantic/v1","domain":"sqlalchemy","document_kind":"snapshot","status":"incomplete","incomplete_kind":"partial_safe","source":{"schema":"code-structure-viz.source-view/v1","kind":"working-tree","head_commit":"ad0e6a6b791a6c803392f795640392d07c4dba02","fingerprint":"9964d1128ce97af132023e0e906721373aa4d8ee45692b1a4af4370f32096b22","file_count":1},"request":{"targets":[],"upstream_depth":1,"downstream_depth":1},"coverage":{"candidate_files":1,"parsed_files":1,"failed_files":[],"evidence_files":["src/models.py"],"selected_modules":["models"],"mapped_classes":1,"association_tables":0,"selected_entities":1,"unknown_declarations":4,"frontier":[{"direction":"failure","kind":"row","reference":"sqlalchemy:occurrence:1607f0eb46cc1cd26159fce26a354af8baf679dd2c5de4b251ae79d67c95a961","reason":"unsupported_pattern"},{"direction":"failure","kind":"row","reference":"sqlalchemy:occurrence:ba7e46beeddf7ac8ffbd34f56f022ab5323e001836840f3c8a64bdb38a79cadc","reason":"unsupported_pattern"},{"direction":"failure","kind":"row","reference":"sqlalchemy:occurrence:caf9eab18d6614543865598d43854440a1a98c515371da267c8e16278d2a1e94","reason":"unsupported_pattern"},{"direction":"failure","kind":"row","reference":"sqlalchemy:occurrence:e3782f402c73049e7a2d426deb2f4f275b2f5d7c40411b381966dd9318415aa3","reason":"unsupported_pattern"}],"redaction":{"rule_version":"code-structure-viz.sqlalchemy-redaction/v1","redacted_values":0}},"entities":[{"id":"sqlalchemy:table:eef6af467d783cb824f428570042690ffd9567294e13e0c84c463dc4b049e875","kind":"table","schema_name":null,"name":"items","display_name":"<default>.items","mapping_kind":"declarative_class","mapping_sources":[{"kind":"declarative_class","module":"models","symbol":"models.Item","source":{"path":"src/models.py","range":{"start_line":13,"end_line":16}}}]}],"members":[{"id":"sqlalchemy:row:eee6b8fc026e8572ff67dc5bad5374a3cba1f931005319b36d166cb836417485","owner_id":"sqlalchemy:table:eef6af467d783cb824f428570042690ffd9567294e13e0c84c463dc4b049e875","kind":"column","name":"id","source":{"path":"src/models.py","range":{"start_line":16,"end_line":16}},"type":{"category":"integer","name":"builtins.int","parameters":{"present":false,"category":"absent","redacted":false}},"nullable":null,"primary_key":null,"unique":null,"index":null,"default":{"present":false,"category":"absent","redacted":false},"server_default":{"present":false,"category":"absent","redacted":false},"onupdate":{"present":false,"category":"absent","redacted":false},"server_onupdate":{"present":false,"category":"absent","redacted":false},"computed":{"present":false,"category":"absent","redacted":false},"identity":{"present":false,"category":"absent","redacted":false}}],"relations":[],"diagnostics":[{"type":"diagnostic","schema":"code-structure-viz.diagnostic/v1","code":"CSV-SA-009","severity":"warning","domain":"sqlalchemy","path":"src/models.py","symbol":"sqlalchemy:occurrence:1607f0eb46cc1cd26159fce26a354af8baf679dd2c5de4b251ae79d67c95a961","line":15,"recoverable":true,"message":"SQLAlchemy row declaration could not be represented safely."},{"type":"diagnostic","schema":"code-structure-viz.diagnostic/v1","code":"CSV-SA-009","severity":"warning","domain":"sqlalchemy","path":"src/models.py","symbol":"sqlalchemy:occurrence:ba7e46beeddf7ac8ffbd34f56f022ab5323e001836840f3c8a64bdb38a79cadc","line":15,"recoverable":true,"message":"SQLAlchemy row declaration could not be represented safely."},{"type":"diagnostic","schema":"code-structure-viz.diagnostic/v1","code":"CSV-SA-009","severity":"warning","domain":"sqlalchemy","path":"src/models.py","symbol":"sqlalchemy:occurrence:caf9eab18d6614543865598d43854440a1a98c515371da267c8e16278d2a1e94","line":15,"recoverable":true,"message":"SQLAlchemy row declaration could not be represented safely."},{"type":"diagnostic","schema":"code-structure-viz.diagnostic/v1","code":"CSV-SA-009","severity":"warning","domain":"sqlalchemy","path":"src/models.py","symbol":"sqlalchemy:occurrence:e3782f402c73049e7a2d426deb2f4f275b2f5d7c40411b381966dd9318415aa3","line":15,"recoverable":true,"message":"SQLAlchemy row declaration could not be represented safely."}]}
