{"type":"semantic_snapshot","schema":"code-structure-viz.semantic/v1","domain":"python","document_kind":"snapshot","status":"complete","source":{"schema":"code-structure-viz.source-view/v1","kind":"working-tree","head_commit":"c5bddcac884141f54464ada08f1baa67bac3aa78","fingerprint":"e6d644cffcafa39ada8abb1dcd489b8d024d7975a6a312f47abd85969c648cc1","file_count":1},"request":{"targets":[],"upstream_depth":1,"downstream_depth":1},"coverage":{"candidate_files":1,"parsed_files":1,"failed_files":[],"selected_modules":["app.references"],"selected_entities":4,"frontier":[{"direction":"failure","kind":"symbol","reference":"Missing","reason":"unresolved_reference"}]},"entities":[{"id":"python:class:app.references:Box","kind":"class","module":"app.references","qualified_name":"Box","name":"Box","path":"src/app/references.py","range":{"start_line":22,"end_line":23},"decorators":[]},{"id":"python:class:app.references:Foo","kind":"class","module":"app.references","qualified_name":"Foo","name":"Foo","path":"src/app/references.py","range":{"start_line":8,"end_line":9},"decorators":[]},{"id":"python:class:app.references:Outer","kind":"class","module":"app.references","qualified_name":"Outer","name":"Outer","path":"src/app/references.py","range":{"start_line":12,"end_line":19},"decorators":[]},{"id":"python:class:app.references:Outer.Inner","kind":"class","module":"app.references","qualified_name":"Outer.Inner","name":"Inner","path":"src/app/references.py","range":{"start_line":13,"end_line":14},"decorators":[]}],"members":[{"id":"python:member:56b3980b1946f6b1eeb0c1efa741e5065502897237ae42d9f0d05a4531417099","owner_id":"python:class:app.references:Outer","kind":"field","name":"external","scope":"class","property_role":null,"method_kind":null,"annotation":"external.models.External","signature":null,"decorators":[],"range":{"start_line":18,"end_line":18}},{"id":"python:member:84eedad8f4e439e07d9875350b579dfbfe7ae492a24109b352dc08bd6f9e47c8","owner_id":"python:class:app.references:Outer","kind":"field","name":"missing","scope":"class","property_role":null,"method_kind":null,"annotation":"Missing","signature":null,"decorators":[],"range":{"start_line":19,"end_line":19}},{"id":"python:member:8b53017d5c63ea43036c27661b3269d4238b546faa6d08a7325b4fc61fed3279","owner_id":"python:class:app.references:Outer","kind":"field","name":"nested","scope":"class","property_role":null,"method_kind":null,"annotation":"Inner","signature":null,"decorators":[],"range":{"start_line":17,"end_line":17}},{"id":"python:member:876c1c9484cb899da59cdaceceeb5c14b3b482c16d0bd5c2eb9b2a6050830e24","owner_id":"python:class:app.references:Outer","kind":"field","name":"same","scope":"class","property_role":null,"method_kind":null,"annotation":"list[Foo]","signature":null,"decorators":[],"range":{"start_line":16,"end_line":16}}],"relations":[{"id":"python:relation:4b7088263f851bd12ade7619264ec2346e0f90f89f2478a697083bade3448838","kind":"composition","source_id":"python:class:app.references:Outer","target":{"resolution":"internal","kind":"class","id":"python:class:app.references:Foo","name":"app.references.Foo"},"via_member_id":"python:member:876c1c9484cb899da59cdaceceeb5c14b3b482c16d0bd5c2eb9b2a6050830e24","annotation":"list[Foo]","range":{"start_line":16,"end_line":16}},{"id":"python:relation:9e8246cb6ee80f53d46c4845e7c6147a0b9517ecc3b4d4cb613067792572894f","kind":"composition","source_id":"python:class:app.references:Outer","target":{"resolution":"internal","kind":"class","id":"python:class:app.references:Outer.Inner","name":"app.references.Outer.Inner"},"via_member_id":"python:member:8b53017d5c63ea43036c27661b3269d4238b546faa6d08a7325b4fc61fed3279","annotation":"Inner","range":{"start_line":17,"end_line":17}},{"id":"python:relation:475d01e51b8448c48b7c18c52b096bca0d609e7b02efd7740bd17ffbfbf00208","kind":"composition","source_id":"python:class:app.references:Outer","target":{"resolution":"external","kind":"symbol","id":null,"name":"external.models.External"},"via_member_id":"python:member:56b3980b1946f6b1eeb0c1efa741e5065502897237ae42d9f0d05a4531417099","annotation":"external.models.External","range":{"start_line":18,"end_line":18}},{"id":"python:relation:bb6cefb6ae9af9425c3ce141d083c3b9986bb85aded1d776a6cecca4785a5d56","kind":"composition","source_id":"python:class:app.references:Outer","target":{"resolution":"unknown","kind":"symbol","id":null,"name":"Missing"},"via_member_id":"python:member:84eedad8f4e439e07d9875350b579dfbfe7ae492a24109b352dc08bd6f9e47c8","annotation":"Missing","range":{"start_line":19,"end_line":19}},{"id":"python:relation:0980a65e8bf73becf0c2a8e85f826945d262d399bcaf94fe6c0ae7fb042747f6","kind":"import_dependency","source_id":"python:module:app.references","target":{"resolution":"external","kind":"module","id":null,"name":"external.models"},"via_member_id":null,"annotation":null,"range":{"start_line":3,"end_line":3}},{"id":"python:relation:a5d87565586687ec5b4adbc61162453e0c8e182cdf2fc20f967a876eb8014640","kind":"import_dependency","source_id":"python:module:app.references","target":{"resolution":"external","kind":"module","id":null,"name":"typing"},"via_member_id":null,"annotation":null,"range":{"start_line":1,"end_line":1}}],"diagnostics":[{"type":"diagnostic","schema":"code-structure-viz.diagnostic/v1","code":"CSV-PY-008","severity":"warning","domain":"python","path":"src/app/references.py","symbol":"Missing","line":19,"recoverable":true,"message":"Python reference could not be resolved statically."}]}
