{"type":"semantic_snapshot","schema":"code-structure-viz.semantic/v1","domain":"python","document_kind":"snapshot","status":"complete","source":{"schema":"code-structure-viz.source-view/v1","kind":"working-tree","head_commit":"97e26ae48b982922c3833179e7da84d97c3ad6a4","fingerprint":"defe75decddaee826a6fd7a0d790ba47099497dbafc9bdf39721869d51b75d15","file_count":2},"request":{"targets":[{"kind":"module","value":"app.a"}],"upstream_depth":0,"downstream_depth":1},"coverage":{"candidate_files":2,"parsed_files":2,"failed_files":[],"selected_modules":["app.a","app.b"],"selected_entities":0,"frontier":[]},"entities":[],"members":[],"relations":[{"id":"python:relation:b86e2483ff7fbd026714a87821d76d587577d534a79123e9f11586e2d204df11","kind":"import_dependency","source_id":"python:module:app.a","target":{"resolution":"internal","kind":"module","id":"python:module:app.b","name":"app.b"},"via_member_id":null,"annotation":null,"range":{"start_line":1,"end_line":1}}],"diagnostics":[]}
