{"type":"semantic_snapshot","schema":"code-structure-viz.semantic/v1","domain":"sqlalchemy","document_kind":"snapshot","status":"complete","source":{"schema":"code-structure-viz.source-view/v1","kind":"working-tree","head_commit":"defa329858debd3915ab1a8819adc62cd82f743c","fingerprint":"207770c69a05e4d15810d5943c3a94c0a091f1c58552c5edefa77b31f12994c7","file_count":1},"request":{"targets":[],"upstream_depth":1,"downstream_depth":1},"coverage":{"candidate_files":1,"parsed_files":1,"failed_files":[],"evidence_files":["src/models.py"],"selected_modules":["models"],"mapped_classes":0,"association_tables":0,"selected_entities":2,"unknown_declarations":0,"frontier":[],"redaction":{"rule_version":"code-structure-viz.sqlalchemy-redaction/v1","redacted_values":0}},"entities":[{"id":"sqlalchemy:table:c357f64acf0a863040621314954fbe7007e2f0f1edde1a4a506decffa033d3b4","kind":"table","schema_name":"a","name":"b.c","display_name":"a.b.c","mapping_kind":"table","mapping_sources":[{"kind":"table","module":"models","symbol":"models.first","source":{"path":"src/models.py","range":{"start_line":3,"end_line":3}}}]},{"id":"sqlalchemy:table:e58d111591d38e758a460e512adad36793b4e86109cc674e01f76607d9924f43","kind":"table","schema_name":"a.b","name":"c","display_name":"a.b.c","mapping_kind":"table","mapping_sources":[{"kind":"table","module":"models","symbol":"models.second","source":{"path":"src/models.py","range":{"start_line":4,"end_line":4}}}]}],"members":[],"relations":[],"diagnostics":[]}
