{"type":"semantic_snapshot","schema":"code-structure-viz.semantic/v1","domain":"sqlalchemy","document_kind":"snapshot","status":"incomplete","incomplete_kind":"partial_safe","source":{"schema":"code-structure-viz.source-view/v1","kind":"working-tree","head_commit":"7c9af53c72a99b691c937f4f7564102e0c2016c6","fingerprint":"4ed9c55314957311e2e46c9bf6040c4ff05f363f90ab255fe5f05073880c2d1c","file_count":1},"request":{"targets":[],"upstream_depth":1,"downstream_depth":1},"coverage":{"candidate_files":1,"parsed_files":1,"failed_files":[],"evidence_files":["src/models.py"],"selected_modules":["models"],"mapped_classes":1,"association_tables":0,"selected_entities":1,"unknown_declarations":4,"frontier":[{"direction":"failure","kind":"row","reference":"sqlalchemy:occurrence:23deff2aac91f48ae8aca78112bccbea3833a14797bbc84c2b572e953fd8c6a6","reason":"unsupported_pattern"},{"direction":"failure","kind":"row","reference":"sqlalchemy:occurrence:7b950fe44f872b94fe83f78d085a4e4b5a2edff8dfc635b92e0a6611bdc308b7","reason":"unsupported_pattern"},{"direction":"failure","kind":"row","reference":"sqlalchemy:occurrence:b916641dd8e3ca95c03c51a6bbea0ea939a94ff9e3a97972979ea0bd3e3f5651","reason":"unsupported_pattern"},{"direction":"failure","kind":"row","reference":"sqlalchemy:occurrence:e80d774000d059e7a5bd83f44046d8f3d1b50bfbcd265c526c9d38eb1b1abe62","reason":"unsupported_pattern"}],"redaction":{"rule_version":"code-structure-viz.sqlalchemy-redaction/v1","redacted_values":0}},"entities":[{"id":"sqlalchemy:table:eef6af467d783cb824f428570042690ffd9567294e13e0c84c463dc4b049e875","kind":"table","schema_name":null,"name":"items","display_name":"<default>.items","mapping_kind":"declarative_class","mapping_sources":[{"kind":"declarative_class","module":"models","symbol":"models.Item","source":{"path":"src/models.py","range":{"start_line":11,"end_line":20}}}]}],"members":[{"id":"sqlalchemy:row:eee6b8fc026e8572ff67dc5bad5374a3cba1f931005319b36d166cb836417485","owner_id":"sqlalchemy:table:eef6af467d783cb824f428570042690ffd9567294e13e0c84c463dc4b049e875","kind":"column","name":"id","source":{"path":"src/models.py","range":{"start_line":20,"end_line":20}},"type":{"category":"integer","name":"builtins.int","parameters":{"present":false,"category":"absent","redacted":false}},"nullable":null,"primary_key":null,"unique":null,"index":null,"default":{"present":false,"category":"absent","redacted":false},"server_default":{"present":false,"category":"absent","redacted":false},"onupdate":{"present":false,"category":"absent","redacted":false},"server_onupdate":{"present":false,"category":"absent","redacted":false},"computed":{"present":false,"category":"absent","redacted":false},"identity":{"present":false,"category":"absent","redacted":false}}],"relations":[],"diagnostics":[{"type":"diagnostic","schema":"code-structure-viz.diagnostic/v1","code":"CSV-SA-009","severity":"warning","domain":"sqlalchemy","path":"src/models.py","symbol":"sqlalchemy:occurrence:e80d774000d059e7a5bd83f44046d8f3d1b50bfbcd265c526c9d38eb1b1abe62","line":14,"recoverable":true,"message":"SQLAlchemy row declaration could not be represented safely."},{"type":"diagnostic","schema":"code-structure-viz.diagnostic/v1","code":"CSV-SA-009","severity":"warning","domain":"sqlalchemy","path":"src/models.py","symbol":"sqlalchemy:occurrence:7b950fe44f872b94fe83f78d085a4e4b5a2edff8dfc635b92e0a6611bdc308b7","line":15,"recoverable":true,"message":"SQLAlchemy row declaration could not be represented safely."},{"type":"diagnostic","schema":"code-structure-viz.diagnostic/v1","code":"CSV-SA-009","severity":"warning","domain":"sqlalchemy","path":"src/models.py","symbol":"sqlalchemy:occurrence:b916641dd8e3ca95c03c51a6bbea0ea939a94ff9e3a97972979ea0bd3e3f5651","line":16,"recoverable":true,"message":"SQLAlchemy row declaration could not be represented safely."},{"type":"diagnostic","schema":"code-structure-viz.diagnostic/v1","code":"CSV-SA-009","severity":"warning","domain":"sqlalchemy","path":"src/models.py","symbol":"sqlalchemy:occurrence:23deff2aac91f48ae8aca78112bccbea3833a14797bbc84c2b572e953fd8c6a6","line":17,"recoverable":true,"message":"SQLAlchemy row declaration could not be represented safely."}]}
