{"type":"semantic_snapshot","schema":"code-structure-viz.semantic/v1","domain":"python","document_kind":"snapshot","status":"complete","source":{"schema":"code-structure-viz.source-view/v1","kind":"working-tree","head_commit":"f2dcd95959a5c94b0a4a5a60f7f91b07d9edd86f","fingerprint":"f58402f99d9c1f8fbc5fc244babbc4d04b9fbc596b8f0b16e2f0438f76c66013","file_count":3},"request":{"targets":[],"upstream_depth":1,"downstream_depth":1},"coverage":{"candidate_files":3,"parsed_files":3,"failed_files":[],"selected_modules":["domain.base","domain.order","domain.service"],"selected_entities":4,"frontier":[]},"entities":[{"id":"python:class:domain.base:Base","kind":"class","module":"domain.base","qualified_name":"Base","name":"Base","path":"src/domain/base.py","range":{"start_line":1,"end_line":2},"decorators":[]},{"id":"python:class:domain.order:Order","kind":"class","module":"domain.order","qualified_name":"Order","name":"Order","path":"src/domain/order.py","range":{"start_line":7,"end_line":18},"decorators":[{"name":"dataclasses.dataclass","called":false}]},{"id":"python:class:domain.order:Order.State","kind":"class","module":"domain.order","qualified_name":"Order.State","name":"State","path":"src/domain/order.py","range":{"start_line":10,"end_line":11},"decorators":[]},{"id":"python:class:domain.service:OrderService","kind":"class","module":"domain.service","qualified_name":"OrderService","name":"OrderService","path":"src/domain/service.py","range":{"start_line":6,"end_line":8},"decorators":[]}],"members":[{"id":"python:member:3f80ba43b2883f472f73096e03b8e8beb864e2ea7bc21e234341194b2627aed1","owner_id":"python:class:domain.order:Order","kind":"field","name":"identifier","scope":"class","property_role":null,"method_kind":null,"annotation":"int","signature":null,"decorators":[],"range":{"start_line":8,"end_line":8}},{"id":"python:member:68a451e4a86f689a6d9c64c5e9dddba6156c472e12adcc693243c463c8d86b52","owner_id":"python:class:domain.order:Order","kind":"field","name":"state","scope":"instance","property_role":null,"method_kind":null,"annotation":"State","signature":null,"decorators":[],"range":{"start_line":14,"end_line":14}},{"id":"python:member:dff18cd67c78d3ac34c7405b9aeaa64f58aca21d9dc9b3a7cdd5d8317284587a","owner_id":"python:class:domain.order:Order","kind":"property","name":"current_state","scope":null,"property_role":"getter","method_kind":null,"annotation":"State","signature":{"async":false,"parameters":[{"name":"self","kind":"positional_or_keyword","annotation":null,"has_default":false}],"returns":"State"},"decorators":[{"name":"property","called":false}],"range":{"start_line":17,"end_line":18}},{"id":"python:member:00c38d83b64182ee22b238bd6671265bf435d2775f76e2762d0e5f52dfd573a1","owner_id":"python:class:domain.order:Order","kind":"method","name":"__init__","scope":null,"property_role":null,"method_kind":"instance","annotation":null,"signature":{"async":false,"parameters":[{"name":"self","kind":"positional_or_keyword","annotation":null,"has_default":false},{"name":"state","kind":"positional_or_keyword","annotation":"State","has_default":false}],"returns":"None"},"decorators":[],"range":{"start_line":13,"end_line":14}},{"id":"python:member:c58f2b1c643df91eb9f18c35f5ad63d84b5e9aaa5a37096d17a99296f764685b","owner_id":"python:class:domain.service:OrderService","kind":"method","name":"submit","scope":null,"property_role":null,"method_kind":"instance","annotation":null,"signature":{"async":true,"parameters":[{"name":"self","kind":"positional_or_keyword","annotation":null,"has_default":false},{"name":"order","kind":"positional_or_keyword","annotation":"domain.order.Order","has_default":false},{"name":"gateway","kind":"positional_or_keyword","annotation":"external.gateway.Gateway","has_default":false}],"returns":"domain.order.Order"},"decorators":[],"range":{"start_line":7,"end_line":8}}],"relations":[{"id":"python:relation:c6fb52b139be7e63e9f3ba10920c5ef6670f98aeddf76cdb1e931cf97fc88829","kind":"inheritance","source_id":"python:class:domain.order:Order","target":{"resolution":"internal","kind":"class","id":"python:class:domain.base:Base","name":"domain.base.Base"},"via_member_id":null,"annotation":"domain.base.Base","range":{"start_line":7,"end_line":7}},{"id":"python:relation:5cf87573f2eb24a8ca4c6153966a53cb2a7d53348d228a4b1f1ae19f3b20e94c","kind":"composition","source_id":"python:class:domain.order:Order","target":{"resolution":"internal","kind":"class","id":"python:class:domain.order:Order.State","name":"domain.order.Order.State"},"via_member_id":"python:member:68a451e4a86f689a6d9c64c5e9dddba6156c472e12adcc693243c463c8d86b52","annotation":"State","range":{"start_line":14,"end_line":14}},{"id":"python:relation:a9ec23c540e705ad9a12cd76f0d9825c19716fa8d4a7a507e9114b2cfde55bcf","kind":"typed_dependency","source_id":"python:class:domain.order:Order","target":{"resolution":"internal","kind":"class","id":"python:class:domain.order:Order.State","name":"domain.order.Order.State"},"via_member_id":"python:member:00c38d83b64182ee22b238bd6671265bf435d2775f76e2762d0e5f52dfd573a1","annotation":"State","range":{"start_line":13,"end_line":13}},{"id":"python:relation:7fc9e0f1039c09f77a8591085af6ef480ed4b9d86693df409cb1ffccc50af165","kind":"typed_dependency","source_id":"python:class:domain.order:Order","target":{"resolution":"internal","kind":"class","id":"python:class:domain.order:Order.State","name":"domain.order.Order.State"},"via_member_id":"python:member:dff18cd67c78d3ac34c7405b9aeaa64f58aca21d9dc9b3a7cdd5d8317284587a","annotation":"State","range":{"start_line":17,"end_line":17}},{"id":"python:relation:61d9fab83765f74e8eea8e2736e397a4ff3f1e41011e6df5d9ac8943d4b77801","kind":"typed_dependency","source_id":"python:class:domain.service:OrderService","target":{"resolution":"internal","kind":"class","id":"python:class:domain.order:Order","name":"domain.order.Order"},"via_member_id":"python:member:c58f2b1c643df91eb9f18c35f5ad63d84b5e9aaa5a37096d17a99296f764685b","annotation":"domain.order.Order","range":{"start_line":7,"end_line":7}},{"id":"python:relation:db7b5f498d1ad89bbb9753b2a260ef586e54e85b61189b56edae2517e06e450b","kind":"typed_dependency","source_id":"python:class:domain.service:OrderService","target":{"resolution":"external","kind":"symbol","id":null,"name":"external.gateway.Gateway"},"via_member_id":"python:member:c58f2b1c643df91eb9f18c35f5ad63d84b5e9aaa5a37096d17a99296f764685b","annotation":"external.gateway.Gateway","range":{"start_line":7,"end_line":7}},{"id":"python:relation:07425ae6133f67ea117fc6a8a03fd6dc69874544dd8a72a4d1bfccadb529dbe9","kind":"import_dependency","source_id":"python:module:domain.order","target":{"resolution":"internal","kind":"module","id":"python:module:domain.base","name":"domain.base"},"via_member_id":null,"annotation":null,"range":{"start_line":3,"end_line":3}},{"id":"python:relation:e6ea3835bedd786a4cd7242c9d3c6c4341c09534a3fb702d2b0e9bf1b910f24d","kind":"import_dependency","source_id":"python:module:domain.order","target":{"resolution":"external","kind":"module","id":null,"name":"dataclasses"},"via_member_id":null,"annotation":null,"range":{"start_line":1,"end_line":1}},{"id":"python:relation:731e6c1e7e81744e19d95f3dc60840323c62fd5ceb64fc5662a1948051fb3b15","kind":"import_dependency","source_id":"python:module:domain.service","target":{"resolution":"internal","kind":"module","id":"python:module:domain.order","name":"domain.order"},"via_member_id":null,"annotation":null,"range":{"start_line":3,"end_line":3}},{"id":"python:relation:7a9ead6a5c217e5baba6dca4d4b83c12a71ca19545b0d9951e081c863a746ac6","kind":"import_dependency","source_id":"python:module:domain.service","target":{"resolution":"external","kind":"module","id":null,"name":"external.gateway"},"via_member_id":null,"annotation":null,"range":{"start_line":1,"end_line":1}}],"diagnostics":[]}
