{"type":"semantic_snapshot","schema":"code-structure-viz.semantic/v1","domain":"python","document_kind":"snapshot","status":"complete","source":{"schema":"code-structure-viz.source-view/v1","kind":"working-tree","head_commit":"3274501402c1fc84815da83fe61999b00e399e99","fingerprint":"ebd47e7c5c75537efb42760415ddf9985492940c8a99f083332f70afc10bd3e8","file_count":1},"request":{"targets":[],"upstream_depth":1,"downstream_depth":1},"coverage":{"candidate_files":1,"parsed_files":1,"failed_files":[],"selected_modules":["app.dynamic"],"selected_entities":1,"frontier":[]},"entities":[{"id":"python:class:app.dynamic:Safe","kind":"class","module":"app.dynamic","qualified_name":"Safe","name":"Safe","path":"src/app/dynamic.py","range":{"start_line":1,"end_line":2},"decorators":[]}],"members":[],"relations":[],"diagnostics":[]}
