{"type":"semantic_snapshot","schema":"code-structure-viz.semantic/v1","domain":"python","document_kind":"snapshot","status":"complete","source":{"schema":"code-structure-viz.source-view/v1","kind":"working-tree","head_commit":"6e8c914084ad9c164fb036bd38e0afd9a3986a7b","fingerprint":"69331ffebdfba6255b5f8b816275efa26a5b39ea83ac17e6ee2e776e4f40c867","file_count":3},"request":{"targets":[],"upstream_depth":1,"downstream_depth":1},"coverage":{"candidate_files":3,"parsed_files":3,"failed_files":[],"selected_modules":["app.entry","app.helpers","app.model"],"selected_entities":1,"frontier":[]},"entities":[{"id":"python:class:app.model:Model","kind":"class","module":"app.model","qualified_name":"Model","name":"Model","path":"src/app/model.py","range":{"start_line":1,"end_line":2},"decorators":[]}],"members":[],"relations":[{"id":"python:relation:10512f5899183f1442e68373d3ae4414ac89b0a6e17baff70d085a1dee8e0cbf","kind":"import_dependency","source_id":"python:module:app.entry","target":{"resolution":"internal","kind":"module","id":"python:module:app.helpers","name":"app.helpers"},"via_member_id":null,"annotation":null,"range":{"start_line":1,"end_line":1}},{"id":"python:relation:af173a907368a044523368f9cc21b5736712280de5714f2b8b52b83ee784ea0e","kind":"import_dependency","source_id":"python:module:app.entry","target":{"resolution":"internal","kind":"module","id":"python:module:app.model","name":"app.model"},"via_member_id":null,"annotation":null,"range":{"start_line":2,"end_line":2}}],"diagnostics":[]}
