{"type":"semantic_snapshot","schema":"code-structure-viz.semantic/v1","domain":"python","document_kind":"snapshot","status":"complete","source":{"schema":"code-structure-viz.source-view/v1","kind":"working-tree","head_commit":"e8e0e24b5c1480db86a73abe5b822d2e029c7d6c","fingerprint":"f13b6a792e0810ee48be5ce72e2ef85a7a2e09c1133c87e91ce93ae844dce114","file_count":2},"request":{"targets":[],"upstream_depth":1,"downstream_depth":1},"coverage":{"candidate_files":2,"parsed_files":2,"failed_files":[],"selected_modules":["app.owner","app.types"],"selected_entities":1,"frontier":[]},"entities":[{"id":"python:class:app.owner:Owner","kind":"class","module":"app.owner","qualified_name":"Owner","name":"Owner","path":"src/app/owner.py","range":{"start_line":4,"end_line":5},"decorators":[]}],"members":[{"id":"python:member:7c9b4a6a38c3a8810b33520bf019feb691cd0762054b3af451401441bae28af9","owner_id":"python:class:app.owner:Owner","kind":"field","name":"module","scope":"class","property_role":null,"method_kind":null,"annotation":"app.types","signature":null,"decorators":[],"range":{"start_line":5,"end_line":5}}],"relations":[{"id":"python:relation:c9175c2a959e2aaf3f7a459a4d8d001f8d0a0058a7e81355c37ca882f5c0d459","kind":"composition","source_id":"python:class:app.owner:Owner","target":{"resolution":"internal","kind":"module","id":"python:module:app.types","name":"app.types"},"via_member_id":"python:member:7c9b4a6a38c3a8810b33520bf019feb691cd0762054b3af451401441bae28af9","annotation":"app.types","range":{"start_line":5,"end_line":5}},{"id":"python:relation:50ade0766fc1669e30cf23c3eeaa54f836e8c2aa6a865ecac26b9a113b3824be","kind":"import_dependency","source_id":"python:module:app.owner","target":{"resolution":"internal","kind":"module","id":"python:module:app.types","name":"app.types"},"via_member_id":null,"annotation":null,"range":{"start_line":1,"end_line":1}}],"diagnostics":[]}
