{"type":"semantic_snapshot","schema":"code-structure-viz.semantic/v1","domain":"python","document_kind":"snapshot","status":"incomplete","incomplete_kind":"partial_safe","source":{"schema":"code-structure-viz.source-view/v1","kind":"working-tree","head_commit":"c8d039884e251dbbd038502a7cdd9c10a1e9cf6d","fingerprint":"af5e745a4608a2bcd25d9f71c680a0956bb6bc0021bd951c4ee8395918938abf","file_count":2},"request":{"targets":[{"kind":"module","value":"app.good"}],"upstream_depth":1,"downstream_depth":1},"coverage":{"candidate_files":2,"parsed_files":1,"failed_files":[{"path":"src/app/broken.py","stage":"parse","diagnostic_code":"CSV-PY-003"}],"selected_modules":["app.good"],"selected_entities":1,"frontier":[{"direction":"failure","kind":"file","reference":"src/app/broken.py","reason":"failed_source"}]},"entities":[{"id":"python:class:app.good:Good","kind":"class","module":"app.good","qualified_name":"Good","name":"Good","path":"src/app/good.py","range":{"start_line":1,"end_line":2},"decorators":[]}],"members":[],"relations":[],"diagnostics":[{"type":"diagnostic","schema":"code-structure-viz.diagnostic/v1","code":"CSV-PY-003","severity":"error","domain":"python","path":"src/app/broken.py","symbol":null,"line":1,"recoverable":true,"message":"Python source could not be parsed with the v1 Python 3.12 grammar."}]}
